{
  "templateId": "500123",
  "uri": "example_value",
  "name": "Example Title",
  "description": "A sample description.",
  "created": "example_value",
  "lastModified": "example_value",
  "lastUsed": "example_value",
  "shared": "example_value",
  "folderId": "500123",
  "folderName": "example_value",
  "emailSubject": "user@example.com",
  "emailBlurb": "user@example.com",
  "signingLocation": "example_value",
  "documents": [],
  "status": "example_value"
}